Sheet: booklist
A1: Title | B1: Author | C1: Format | D1: Quantity | E1: Price | F1: Total
A2: The Adventures of Duck and Goose | B2: Sir Quackalot | C2: paperback | D2: 3 | E2: 10.99 | F2: of:=[.D2]*[.E2] -> 32.97
A3: The Return of Duck and Goose | B3: Sir Quackalot | C3: paperback | D3: 5 | E3: 19.99 | F3: of:=[.D3]*[.E3] -> 99.95
A4: More Fun with Duck and Goose | B4: Sir Quackalot | C4: paperback | D4: 1 | E4: 12.99 | F4: of:=[.D4]*[.E4] -> 12.99
A5: Duck and Goose on Holiday | B5: Sir Quackalot | C5: paperback | D5: 3 | E5: 11.99 | F5: of:=[.D5]*[.E5] -> 35.97
A6: The Return of Duck and Goose | B6: Sir Quackalot | C6: hardback | D6: 3 | E6: 19.99 | F6: of:=[.D6]*[.E6] -> 59.97
A7: The Adventures of Duck and Goose | B7: Sir Quackalot | C7: hardback | D7: 9 | E7: 18.99 | F7: of:=[.D7]*[.E7] -> 170.91
A8: My Friend is a Duck | B8: A. Parrot | C8: paperback | D8: 20 | E8: 14.99 | F8: of:=[.D8]*[.E8] -> 299.8
A9: Annotated Notes on the ‘Duck and Goose’ chronicles | B9: Prof Macaw | C9: ebook | D9: 10 | E9: 8.99 | F9: of:=[.D9]*[.E9] -> 89.9
A10: ‘Duck and Goose’ Cheat Sheet for Students | B10: Polly Parrot | C10: ebook | D10: 50 | E10: 5.99 | F10: of:=[.D10]*[.E10] -> 299.5
A11: ‘Duck and Goose’: an allegory for modern times? | B11: Bor Ing | C11: hardback | D11: 0 | E11: 59.99 | F11: of:=[.D11]*[.E11] -> 0
A12: Oh No! The Chickens have Escaped! | B12: Dickie Duck | C12: ebook | D12: 11 | E12: 2 | F12: of:=[.D12]*[.E12] -> 22
A14: Totals | D14: of:=SUM([.D2:.D12]) -> 115 | F14: of:=SUM([.F2:.F12]) -> 1123.96